{
  "accountNumber": "000003FACLTY",
  "accountName": "Barry",
  "facilityId": 3,
  "programCodeInfo": "ARP,CSNOX,CSSO2G2,MATS",
  "vintageYear": 2016,
  "totalBlock": 10033,
  "startBlock": 266955,
  "endBlock": 276987,
  "stateCode": "AK",
  "epaRegion": 5,
  "ownerOperator": "Alabama Power Company (Operator)|Alabama Power Company (Owner)",
  "accountType": "Facility Account"
}